編號,語別,詞語,義項,翻譯,語句編號,語句,音檔,語句翻譯,出處
703775,24,minpudruk,2403810,跳躍,,minpudruk a pa’ulid/paqulid tua levan tiamadju.,,他們開心的跳躍著。,
703776,24,minpuruk,2403811,跳,,minpuruk ti muakay tua qezung.,,muakay(女子名)跳窗戶。,
703777,24,minpurupuruk,2403812,正在跳,,minpurupuruk aken ta calis.,,我正在跳繩子。,
703778,24,minqut,2403813,出現,,samalji a mareka situ ka minqut aken itua kinateveteveljan niamadju.,,學生很驚訝我出現在他們的會中。,
703779,24,minseg,2403814,靜止,,na minseg a vaung ayatua neka nu vali.,,因為沒有風所以海面是靜止的。,
703780,24,minseganga,2403815,停止了,,ka tutuin na kina sa menutjmutj timadju minseganga qaung.,,他等到母親餵奶，才停止哭鬧。,
703781,24,minselak,2403816,花苞開,,patagiljanga a minselak a hana.,,花苞已經開始開了。,
703786,24,mintjus,2403817,驚嚇；驚訝,,mintjus ti baru ta ku kai.,,我的話使baru驚訝。,
703786,24,mintjus,2403818,嚇一跳,,"ka pacun aken tua kamavanan, mintjus aken sake kirimu a vavaik.",,當我看到百步蛇，我嚇一跳趕快離開。,
703787,24,mintuluq,2403819,跑步,,djaljav aravac ti kaka nu mintuluq.,,我哥哥跑得很快。,
703788,24,mintulutuluq,2403820,正在跑步,,mintulutuluq a kakedrian.,,小孩子們在跑步。,
703790,24,minvalak,2403821,腫,,"kinac na qatjuvi aza kula nimadju, manasika na minvalak anga.",,他的腳被蛇咬，所以腫起來了。,
703790,24,minvalak,2403822,腫脹,,minvalak azua cinaljedj na pangac.,,那被黃蜂螯的都腫起來。,
703791,24,miperper,2403823,飛,,"aza pa’uzi’uzipen/paquziquzipen nimadju a ’aya’ayam/qayaqayam miperper sa vaik anga, manasika na sa’etju/saqetju a varung nimadju.",,他養的小鳥飛走了，所以她很傷心。,
703791,24,miperper,2403824,飛翔,,na misepi a ken tu makaya a ken a miperper.,,我夢到自己在飛翔。,
703792,24,miperperper,2403825,正在飛翔,,pacunu azua qayaqayam a miperperper.,,看那隻鳥正在飛翔。,
703792,24,miperperper,2403826,飛舞,,sa miperperper i tua marekahana’.,,並且在花叢裡飛舞。,
703793,24,mipicul,2403827,努力,,mipicul a taqaljaqaljan a kitulu ta sikipaisuan.,,部落族人努力學習賺錢的方法。,
703795,24,miqaqedru,2403828,男性器官勃起,,miqaqedru nuaya sini pu patarevan tua na migacalj a qalici nua uqaljai.,,miqaqedru是用來比方男性生殖器勃起來的文雅用語。,
703796,24,miqaqili,2403829,搖擺；擺動臀部,,neka nu miqaqili tua zian nua payuan.,,排灣族的舞姿沒有在擺動臀部。,
703796,24,miqaqili,2403829,搖擺；擺動臀部,,nu semenai timadju miqaqili a ravac a siqilad.,,他唱歌的時候臀部也搖擺。,
703798,24,mirava,2403830,打包,,na mirava anga sun ta su turivecan?,,你的東西打包好了嗎?,
703798,24,mirava,2403831,裝扮,,savid a nakiljengua’ a mirava nuri semaazua a i tua kinateveteveljan nua masudjusudju.,,所有前往婚禮現場的人都必須盛裝。,
703798,24,mirava,2403832,盛裝,,mirava timadju sa vaik a zemian.,,他盛裝後去跳舞。,
703799,24,mirengreng,2403833,熊熊烈火,,lemidam a sapui nu mirengreng.,,強火伸出火舌。,
703800,24,misekuc,2403834,抽筋,,madjulu itjen a misekuc nu inika tjen a ru ’undu.,,若不常運動容易抽筋。,
703801,24,miseleman,2403835,昏暗狀態,,kamasukincengelj miseleman a qadaw.,,午後天就昏暗。,
703801,24,miseleman,2403835,昏暗狀態,,nu kaljavuceleljan madjele a miseleman a qadaw.,,冬天的時候天很快昏暗。,
703801,24,miseleman,2403836,低潮,,miseleman aku varung ka macai ti kama.,,父親的過世使我陷入低潮。,
703803,24,misepi,2403837,作夢,,na misepi a ken tu makaya a ken a miperper.,,我夢到自己在飛翔。,
703809,24,mitjezu,2403838,打嗝,,kana mitjezu itjen tjara ini ka na sarungaq a na tja vicuka.,,只要有打嗝的現象表示胃出了問題。,
703810,24,mitung,2403839,穿著傳統服,,"nu kaljapalisian, mitung itjen ta kinacalisianan a taqaljaqaljan.",,適逢祭典，全部落的人都穿著傳統服。,
703810,24,mitung,2403840,穿（如穿衣服）,,,,,
703810,24,mitung,2403841,穿；穿衣服,,,,,
703811,24,muakay,2403842,人名（女性）,,katje qimangan a djapalj ni muakay.,,muakay(女子名)的大腿有胎記。,
703812,24,muaqami,2403843,阿美族,,aicu a se muaqami mana aray a sikiciqaciqav.,,阿美族是用網子來捕魚。,
703814,24,muceng,2403844,扳著臉,,,,,
703815,24,mudingan,2403845,臉,,mudingan azua.,,那是臉。,
703815,24,mudingan,2403845,臉,,pacunu sa cekas ta mudingan ni masegeseg.,,看著masegeseg(男姓)臉上乾裂。,
703815,24,mudingan,2403846,臉孔,,"nguangua’ aravac a mudingan ni kina i tua ku zuga,",,在我的圖畫裡，我媽媽的臉孔很漂亮，,
703816,24,mugi,2403847,麥,,kasicuayan aza nia ’uma/quma na natinaleman tua mugi.,,我們的田以前有種過麥。,
703817,24,mukav,2403848,過貓（植物）,,sanguaq a sandjamain a mukav.,,過貓很做菜。,
703817,24,mukav,2403849,雙蓋蕨,,inika tjengelay a ku kaka a keman tua mukav lja nukanen djuadjuay.,,妹妹不喜歡吃雙蓋蕨進嘴裡黏黏的。,
703819,24,mukui,2403850,木瓜,,nu qudjidjilj anga mukui makayanga tja kanen.,,木瓜要紅了才能吃。,
703820,24,mula,2403851,村,,matja unem a mula i tjanuamen a makagu.,,我們瑪家鄉共有六個村。,
703821,24,mulavi’,2403852,溢出（如水溢出來）,,"kirimu qevutju aza zaljum, mulaviq anga za zaljum i bunbun.",,快點把水關掉，水桶裡的水都溢出來了。,
703822,24,mulaviq,2403853,滿溢,,mulaviq a kuppu ni vuvu tua sinara.,,祖父杯子的小米酒溢出來。,
703823,24,muledje,2403854,鮮嫩；嫩的,,kemakan tua namuledje a cemel a ku ljuang.,,我的牛正在吃嫩的草。,
703823,24,muledje,2403854,鮮嫩；嫩的,,muledje a cemel nuna qemudjalj.,,雨後草木很鮮嫩。,
703824,24,mulimulitan,2403855,尊貴之珠,,tjaljapazangalan anga ta qata a mulimulitan.,,珠子之中就屬尊貴之珠最貴重了。,
703825,24,mulinaga,2403856,森永部落,,aicu a kiniveqacan nua se mulinaga i tjagaraus aya tjaucikel a kemasi tjavulung.,,森永部落的創生地依據傳說是在大武山。,
703826,24,mumalj,2403857,再一次,,mumalj a siking.,,再考一次。,
703828,24,mun,2403858,你們,,"a, manu ku aljak a ti tjuku,’aw pasainuinu mun a maraljak?",,哦，原來是我的姪女Tjuku啊，你們母女倆要去哪裡呢？,
703828,24,mun,2403858,你們,,"a, manu marka ku vuvu,’aiyanga mun?",,原來是我的孫女們，你們好嗎？,
703828,24,mun,2403858,你們,,"djavadjavay, ti muni aken, lja pavavaljung mun?",,對不起，我是Muni，請問你們是Pavavaljung府上嗎？,
703828,24,mun,2403858,你們,,izainu anga mun?,,你們現在何處？,
703828,24,mun,2403858,你們,,kacalisiyan mun?,,你們是原住民嗎？,
703828,24,mun,2403858,你們,,mapida mun a marekakakaka?,,你們兄弟姊妹有幾個？,
703828,24,mun,2403858,你們,,mavetu mun taicu?,,這些會使你們吃飽嗎？,
703828,24,mun,2403858,你們,,saljinga aken tu me’aca mun a kirimu.,,我希望你們快快長大。,
703828,24,mun,2403858,你們,,serekay zuku mun?,,你們是魯凱族嗎？,
703828,24,mun,2403858,你們,,"uwi,’aw tiaima mun?",,我在，你們是誰啊？,
703828,24,mun,2403858,你們,,"uzinganga a vali,’aki mun a uri semagakkuanan tucu?",,颱風來了，今天你們還需要上學嗎？,
703829,24,mungez,2403859,綁緊,,quyulju a munqez a su kinacu a kasiv.,,你要扛的木材要綁緊。,
703830,24,muni,2403860,慕妮（女子名）,,na kemasi djukuvukuvulj ti muni.,,慕妮從草原過來了。,
703830,24,muni,2403861,女子名,,,,,
703830,24,muni,2403862,（女子名）,,"djavadjavay, ti muni aken, lja pavavaljung mun?",,對不起，我是Muni，請問你們是Pavavaljung府上嗎？,
703830,24,muni,2403862,（女子名）,,"tjalja’aca’acan ti baru, tjaljakedrikedrian ti muni.",,Baru最高，Muni最矮。,
703832,24,mupu,2403863,築牆,,mupu itjen nusauni.,,待會兒我們要築牆。,
703833,24,mupupu,2403864,正在堆砌石牆,,mupupu a taqaljaqaljan tua namacunuq a djalan.,,居民正在堆砌石牆修護崩塌的道路。,
703834,24,muqadaw,2403865,白天,,masengseng a caucau nu muqadaw.,,人們都在白天工作。,
703835,24,muqic,2403866,眼屎,,"izua muqic itua su qimi, sau pinaqupu.",,在你的臉上有眼屎，去洗把臉。,
703836,24,muqimuqican,2403867,有眼屎的,,"muqimuqican a su mudingan, sau vaiku a minaqup.",,你臉上有眼屎，快去洗臉。,
703837,24,murem,2403868,染色,,ti kina salialim ta murem.,,媽媽在做染色工作。,
703837,24,murem,2403869,染上顏色,,kasicuayan tjitjen a murem a kimadju tua lekelek ljakua tucu izuanga kuba a kipusaliman tua murem.,,過去是我們自己染色線的材料，然而現在都是工廠在做染色工作。,
703838,24,muri,2403870,要；尋覓,,paramur sa ku culjan vaik a ken a muri kakanen.,,我非常的餓，我去尋覓吃的東西。,
703839,24,murigagisilji,2403871,腳根墊高（行走中的樣子）,,namurigagisilj ti kaka i tjanaw nu djemavac.,,tjanaw(男子名)走路時都把腳根墊高。,
703840,24,murikakanen,2403872,覓食,,nu qezemezemetj sasav a murikakanen a ljequ.,,貓頭鷹是在夜間尋覓食物。,
703841,24,muriramalj,2403873,收集漂流木,,muriramalj amen tu nia sisan umaq.,,我們收集漂流木作為建房的材料。,
703842,24,musalj,2403874,雙；兩層；2次,,sikinmusalj anga a qivu nimadju.,,他講第二遍了。,
703843,24,mutja’,2403875,吐,,timadju sa’etju/saqetju a ’ulu/qulu saka mutja’/mutjaq auta a kemasi salim.,,他從昨天晚上頭痛又嘔吐。,
703844,24,mutjaq,2403876,吐,,mutjaq ti kama ta tinekelan ta vava.,,爸爸因為喝酒而吐了。,
703845,24,mutjmutj,2403877,奶嘴,,veliu anga tua mutjmutj.,,要買奶嘴。,
703846,24,na,2403878,竟然...,,na! manu namakuda sun a sika caucau!,,唉喲！原來你是這樣的人。,
703846,24,na,2403879,［屬］,,"nu izua a sinikasadjelung nua varung na ta’alja’aljan tucu,’inuli a kisumadju a kipaparangez ta cemas.",,現在族人有任何心事憂傷，他們自行禱告來依靠上帝。,
703847,24,na makuda anga,2403880,怎樣了,,na makuda anga a su kaka a vavayan?,,你的妹妹怎樣了?,
703850,24,nacemeqeljap,2403881,配著刀的人,,nguanguaq aravac a rakac nu nacemeqeljap a uqaljai.,,勇士配著刀非常壯觀。,
703850,24,nacemeqeljap,2403881,配著刀的人,,vincikan a ceqeljap nua cinakaran a takit.,,男用禮刀的刀鞘是有雕刻圖紋的。,
703851,24,nacemperak,2403882,拆開的人,,tima nacemperak tua nu siqeljevan?,,誰拆壞了你們的木門。,
703852,24,nadjemameq,2403883,有抓到；有捕到,,nadjemameq a ku qaljangetj tua butj.,,我的捕獸夾有抓到松鼠。,
703853,24,nadu-,2403884,具有｢激化｣之意,,,,,
703854,24,naemibuk,2403885,穿著男用上衣,,naemibuk ti kama katiaw.,,爸爸昨天穿著男用上衣 。,
703855,24,nagememegem,2403886,握著,,nagememegem aken ta vat tu ku sivay tjay vuvu.,,我手握著籽粒送給奶奶。,
703856,24,nakaiv,2403887,晚餐,,nakaiv amen tua pinu vutjuljan a ginilegilan a vasa.,,我們吃的晚餐是有加肉的去皮芋頭料理。,
703857,24,nakemaken,2403888,戴著頭巾,,nakemaken tia vuvu a mapuljat.,,每個奶奶都戴著頭巾。,
703860,24,nakemeljang,2403889,認知,,nakemeljang ti Lampav tua kipaquliqulid nu kitulu.,,Lampav(男子名)有認真學習的認知。,
703861,24,nakincengelj,2403890,下午,,makaya aken a vaik a kivangavang nu nakincengelj?,,下午我可以出去玩嗎？,
703861,24,nakincengelj,2403890,下午,,uri semainu sun nu nakincengelj?,,下午你有甚麼打算?,
703862,24,nakipadai,2403891,收割稻米,,kasicuayan tjuruvu a ki raumalj nu nakipadai a pairang.,,過去每逢平地人收割稻米後有不少婦女在田間拾穗。,
703863,24,nakipaday anga,2403892,收割完稻米後,,nu nakipaday anga a pairang pasa vaik a kilagav a mareka i qinaljan a vavayavayan.,,平地人割完稻部落婦女們便會去撿拾收割後遺漏的米穗。,
703864,24,nakipakelay,2403893,受封者,,a kinacadjuran nua ramaljemaljeng i qinaljan kasicuayan izua nakipakelay izua nakipalengleng uta.,,過去部落的長者們也有等級之分有受封耆老也有雲端耆老。,
703865,24,nakipaselem,2403894,遮蔭,,nakipaselem tua supung nua kasiv.,,因為炎熱他用樹葉遮蔭自己。,
703866,24,nakipuvarung,2403895,打算,,nakipuvarung ti vuvu tu kipupakung.,,爺爺有意要私設神壇。,
703867,24,nakiqadilj,2403896,勉強；不情願；忍著,,,,,
703868,24,nakiseljengua’,2403897,好好的,,"izua nakiseljenguaq a ’emiladj timadju inika na kasinu, aika pasalisaliv a su pinacunan.",,他好好的座椅子上，哪裡都沒有去，你可能看錯了哦。,
703869,24,nakiseluc,2403898,上吊的,,pesema a caucau nu nakiseluc a kipapacay.,,上吊自殺的人會吐舌。,
703870,24,nakiukai,2403899,是教會的,,a zua kadjunangan nakiukai.,,那一塊土地已經是教會的了 。,
703871,24,nakizang,2403900,同在,,ulja nakizang a cemas tjanusun.,,願神與你同在。,
703872,24,nakuqat,2403901,兇,,nakuqat aravac aku sinsi.,,我的老師很兇。,
703873,24,nakuya,2403902,不可以；不要,,nakuya cemakav.,,不可以偷竊。,
703873,24,nakuya,2403902,不可以；不要,,nakuya na misakemudan itjen.,,我們不要驕傲。,
703873,24,nakuya,2403903,不要,,nakuya gemaugav a paqeteleng tua sinipavay a nemanga nua qaliqali.,,別人送東西不要接收。,
703873,24,nakuya,2403904,不可以,,"nakuya, anema a sasaven a’emudja’udjalj?",,不可以，外面下著雨出去做什麼？,
703874,24,nakuyakuya,2403905,壞人,,a itua na Paiwan a milimilingan aza nakuyakuya a caucau masan kulavav.,,在排灣族的傳說故事中，壞人會變成老鼠。,
703876,24,nalemuljai,2403906,費力,,,,,
703877,24,nalimuceng,2403907,生悶氣,,nalimuceng ti madju a palalaut.,,他總是在生悶氣。,
703878,24,nalitengic,2403908,板著臉樣,,nalitengic a mudingan nimadju.,,他的臉皺成一團。,
703879,24,naljamecav,2403909,很晴朗,,naljamecav sa kinaqadavan tucu.,,今天的天氣很晴朗。,
703880,24,nalu,2403910,淋巴腺,,inika mapida kemljang tuki anema a pinaka nalu.,,很少人知道淋巴腺排灣族語怎麼說。,
703881,24,naluan,2403911,歌謠中的襯詞,,nu semenasenay tjen itua zemiazian anema tjalja siumaljan nu ayaitjen avan a “naluan katua haiyang”,,歌舞中哪一句是經常被重複唱的，那就是naluan和haiyang。,
703883,24,namacai,2403912,死了,,namacai ka tiav aku vatu.,,我的狗昨天死的。,
703884,24,namacayanga,2403913,已過世；已往生,,izua nu qemazalj uta namacayanga caucau.,,有時候已過世的人會再顯靈。,
703885,24,namacingki,2403914,乾淨的,,namacingki aravac a nia kakesan.,,我家的廚房很乾淨。,
703887,24,namacunuq,2403915,坍塌的；崩塌,,naseceker a men itua namacunuq a djalan.,,我們被迫停頓在路坍之處。,
703888,24,namadjadjaludjalu,2403916,和睦,,aicu a kinacemekeljan nu inika namadjadjaludjalu semaljivalav aravac.,,這個不和睦的家庭令人看了難過。,
703889,24,namadjapeng,2403917,稀爛的,,namadjapeng anga vinli ni kina tjakiyang.,,媽媽買的番茄已經稀爛了。,
703890,24,namadjumulj,2403918,堆積的,,namadjumulj a nia kasiv.,,我們的木材堆積如山。,
703891,24,namadjuq,2403919,留下；殘留,,nu sipecungu sa maljeput anga lungel amin anga a qavu na namadjuq.,,柴火燒盡後留下灰燼。,
703892,24,namadreqel,2403920,被...勒住,,namadreqel a liqu ni vuvu ta vaudj.,,爺爺的脖子被樹藤勒住。,
703893,24,namadripudru,2403921,圓形的,,,,,
703894,24,namadrukung,2403922,灣曲的,,semevec aken tua namadrukung a vatjuljayan.,,我把灣的鐵條弄直。,
703894,24,namadrukung,2403923,彎曲,,"namadrukung azua kizing ikanga makaya sikenud , sau pavaliti.",,去換一個湯匙，那湯匙彎曲不能舀了。,
703895,24,namadudu,2403924,生氣的,,namadudu anga sun?,,你生過氣嗎？,
703895,24,namadudu,2403924,生氣的,,namadudu aravac timadju ka tiaw.,,他對昨天的事很生氣。,
703897,24,namaguraruc,2403925,攪亂；凌亂,,akucu a namaguraruc sa puvurasian?,,這個地瓜園為什麼是如此攪亂？,
703901,24,namakerengec,2403926,皺皺的,,aku namakerengec a su mudingan?,,妳的臉為什麼皺皺的呢？,
703902,24,namakesa,2403927,（植物）成熟,,mequljidrar a ljambu nua paday nu namakesa anga.,,稻穗成熟時會呈現金黃色。,
703903,24,namakuda,2403928,發生了什麼事,,namakuda su kula?,,你的腳怎麼了?,
703903,24,namakuda,2403929,怎麼樣；如何,,,,,
703903,24,namakuda,2403930,什樣的,,mavan a namakuda a su’awsua?,,你的雨傘是哪一把？,
703903,24,namakuda,2403931,什麼樣的,,namakuda azua a’erepus i kalevelevan?,,天上的雲是什麼樣的？,
703903,24,namakuda,2403932,如何,,’aw’aki sun a kemljang tu namakuda a’azi nua zaljum i vaung?,,那麼，你知道海水是什麼味道嗎？,
703903,24,namakuda,2403933,怎樣,,"kumalji a namakuda a kinakudral nua vali,",,不管風有多麼大，,
703903,24,namakuda,2403933,怎樣,,"kumalji a namakuda a pasavavaw a vi’evi’,",,不管浪有多麼高，,
703904,24,namakudanga,2403934,狀況如何,,namakudanga ti su vuvu?,,你的祖母狀況如何?,
703904,24,namakudanga,2403935,是如何,,’aki namakudanga timadju tucu ayau.,,不知道現在他過得怎麼樣。,
703905,24,namalaic,2403936,乾熟,,magucar anga aicu a namalaic a puk.,,這乾熟的樹豆已自動地撥開了。,
703906,24,namalaing,2403937,順心、成就,,ulja namalaing a su vinarungan.,,願你心想事成。,
703907,24,namalalavilavi,2403938,彩色；五顏六色,,,,,
703908,24,namalapay,2403939,重創；重大災害,,aicu a i Kulaljuc namalapay tua raljiz a mulake mana sipasekaumalj nua i sasusuan a pasa Tjakualim.,,泰武部落由於受莫拉克颱風嚴重的災害所以政府遷移到萬金的現住地。,
703909,24,namalingdjelj,2403940,站立,,namalingdjelj timadju i dangadangas .,,他站在懸崖邊。,
703909,24,namalingdjelj,2403941,在任者,,,,,
703911,24,namaliqaqut,2403942,赤裸的,,aku namaliqaqut azua madrusa a maya vuceleljan?,,天氣這麼冷，為什麼那兩人赤著身子呢？,
703912,24,namaljaluai,2403943,很清楚,,"nu inika namaljaluai a pukeljang tua djalan, pasekapalak tua untinting ta zidusia.",,路標不清楚容易誤導汽車駕駛員。,
703913,24,namaljaqic,2403944,受傷成疤痕,,namaljaqic aicu ka kakedrian aken.,,這是我小時候的疤痕。,
703914,24,namaljengis,2403945,燒焦,,namaljengis anga quvalj nimadju.,,他的頭髮被火燒焦了。,
703915,24,namaljenguaq,2403946,不優；不佳；不好,,inika namaljenguaq a kinasengsengan tua icu a tjalupun.,,這一頂帽子做得不好。,
703916,24,namaluka,2403947,鬆動的、鬆開的,,ungezu azua namaluka siqeljevan.,,請鎖緊那已經鬆動的門。,
703917,24,namalumanga,2403948,已經熟了,,"nu namalumanga a veljvelj, madjulu a makapalak.",,如果香蕉已經成熟了的，會很容易壞掉。,
703917,24,namalumanga,2403948,已經熟了,,"nu namalumanga akamaya,madjulu a mapalak.",,如果是已經熟了的芒果，會很容易壞掉。,
703918,24,namangada,2403949,被割傷,,namangada kula ni camak tua kindraljum.,,camak 的腳被碎玻璃割傷了。,
703920,24,namangtjez,2403950,來過已經來了,,na mangtjez anga tia kaka a kemasi pairang.,,哥哥他們從平地回來了。,
703921,24,namanguaq,2403951,幸福,,namanguaq a matjaljaljak nu dadaudavan a mareka aljak.,,若孩子們都很優秀，做父母親的很幸福。,
703921,24,namanguaq,2403952,富有,,namanguaq tiamadju a kemasi tua vuvu.,,他們從祖父母的世代就很富有。,
703922,24,namapaqel,2403953,遭受,,namapaqel aravac ania qinaljan tua zinaljuman ka sicavilj.,,去年的水患我們的村莊遭受相當的災害。,
703923,24,namapaqulid,2403954,實在,,namapaqulid a su kai.,,妳所說的話很實在。,
703924,24,namaparang,2403955,虐待者；欺侮者,,tima namaparang tjanusun?,,是誰欺侮了你?,
703925,24,namapaselem,2403956,被遮住,,aicu a nia umaq namapaselem tua qau.,,我們的家被竹子遮掩。,
703926,24,namapaseleman,2403957,被遮蓋；被遮掩,,aicu a nia umaq namapaselem tua qau.,,我們的家被竹子遮掩。,
703927,24,namapedi,2403958,被打碎了,,aku namapedi anga azua pan?,,那塊餅為什麼被打碎了呢?,
703928,24,namapelju’,2403959,滿滿,,izua namapeljuq a zaljum itua kupu.,,杯子裡有滿滿的水。,
703930,24,namapenetjanga,2403960,已決定,,namapenetjanga tu tima uri masan kalaingan.,,早已決定誰要擔任領袖。,
703931,24,namapuisiqanga,2403961,已經尿濕,,semavaqar a caucau a pulapulavanga sa utjautjaq saka namapuisiqanga kasui.,,看到醉酒的人，嘔吐又已經尿濕褲子就會令人噁心。,
703932,24,namapulju,2403962,窮困的人,,qaruten a paka tua kavatjesni kina a vasa tua mareka namapulju a caucau.,,母親用小竹籃把竽頭分享給窮困的人。,
703933,24,namapuzangal,2403963,期待、期望,,,,,
703934,24,namaqaluvu,2403964,有變亂；紊亂,,,,,
703935,24,namaqaquljis,2403965,錯亂倒置,,namaqaquljis a su pinakelayan.,,你掛的東西方向錯亂倒置。,
703936,24,namaqar,2403966,軟弱,,namaqar aravac timadju inika makaya masengseng.,,他軟弱到沒有工作能力。,
703937,24,namaqaran,2403967,軟弱的樣子,,"nu kidjadjlan timadju tua qaliqali a kemudanga, mapacun a namaqaran.",,與別人一起做任何事情就會顯出他的弱點。,
703938,24,namaqaripi,2403968,被壓扁了,,aku namaqaripi anga azua vintang?,,那個銅盆為什麼已經扁了呢？,
703939,24,namaqepu,2403969,聚集的,,tjuruvu aravac a vavayavayan a namaqepu.,,有很多婦女參加聚會。,
703940,24,namarekatjengelay,2403970,相戀,,,,,
703941,24,namasan,2403971,屬於,,"aicu a pinuiqinaljanan nitjen a se paiwan, namsan pazangal aicu a mamazangiljan, pualju, parakaljay katua tjaipungav.",,在排灣族社會裡王族領袖，末階貴族，祭司與靈媒都受尊重。,
703941,24,namasan,2403971,屬於,,namasan maqulip ti kina i tjuku ayatua na pucekelj ljakua inika napualjak.,,我阿姨tjuku已結婚但是因為不孕屬於無後。,
703942,24,namasangav,2403972,不歡迎、排斥,,inika ken a namasangav tua timanga.,,我並沒有不歡迎任何人。,
703943,24,namaseqetj,2403973,誠信的、忠實的,,aicu a marugaruc a qata sinizenger tua namaseqetj a caucau.,,仕梳之珠是象徵一位條理有序的人。,
703944,24,namasevur,2403974,倒塌,,aicu a rinaljizan tucu namasevur a umaq niamadju saka namapasaqetju a kinacekeljan.,,這次的颱風雨造成他們家屋崩塌全家人都遭受創傷。,
703945,24,namasisapuy,2403975,帶著火,,aicu a qucivauvav namasisapuy sa mipereper nu qezemezemetj.,,螢火蟲在夜間提着火飛舞。,
703946,24,namasu’iljang,2403976,乾淨,,aicu a imaza namasuqiljang aravac.,,這裡非常乾淨。,
703949,24,namatjani,2403977,跌倒,,"namatjani aken katiyav, mana sika minevalak na ku kula.",,我昨天有跌倒，所以我的腳腫起來了。,
703949,24,namatjani,2403978,跌倒了,,namatjani aken takadjaman ka kivangavangavang aken.,,今天早上當我在玩耍的時候跌倒了。,
703950,24,namatjaq,2403979,還沒熟,,namatjaq anan su ciqav.,,你/妳煮的魚還是生的沒有熟。,
703951,24,namatjeveng,2403980,潮濕的,,,,,
703952,24,namatjuljur,2403981,排成一列,,nu selemananga namatjuljur ania iu a sematua tapav niamadju.,,到了傍晚我們的羊排成一列回到自己的羊舍。,
703953,24,namatjuljuranga,2403982,自成一列,,a mareka sinzia namatjuljuranga pusausau tua buksi niamadju a qemacuvung tua sengsengan .,,信徒自成一列歡送他們退休的牧師。,
703954,24,namavadavadai,2403983,分布,,,,,
703956,24,namavungelay,2403984,懷孕的,,pinaka palisi a keman tua maqaida veljevelj a namavungelay a vavayan.,,懷孕的婦女是禁止吃連體突變的香蕉。,
703957,24,namaya,2403985,一樣；相似,,aicu aku vuvu ati ljegean namaya tua kina kinamudinganan.,,我的孫女 ljegean 的臉型與她母親很相似。,
703957,24,namaya,2403986,好像,,’aw azua a cemel namaya tua yugiugi.,,而草好像在跳舞。,
703957,24,namaya,2403986,好像,,namaya tua semnasenay azua a vuciar.,,花朵好像在唱歌。,
703957,24,namaya,2403987,倣效,,ulja aken a namaya tjanusun a namasanpuvarung a sinsi.,,希望和你一樣，將來做一個有智慧的老師。,
703958,24,namayatucu,2403988,這樣；如此,,,,,
703958,24,namayatucu,2403989,就是如此,,namayatucu a kinangua’ nua nia kakudan a payuanzuku.,,我們的傳統是這樣的美。,
703958,24,namayatucu,2403990,是如此,,"azua a patarevan nazua a kai namayatucu,",,那句話的意思就是，,
703958,24,namayatucu,2403991,如此的,,namayatucu a tja sivaivaik.,,我們所努力的事是如此的。,
703959,24,namazatja,2403992,平坦,,akuizua sa namazatja imaza makaya tja putapavan.,,這裡剛好有平坦地可以蓋工寮。,
703960,24,nametad,2403993,乾的,,alapu tua nametad a kasiv.,,要撿乾的木材。,
703960,24,nametad,2403993,乾的,,nametad aicu a pana.,,這條河已經乾涸。,
703960,24,nametad,2403993,乾的,,nametad anga zua drinasi i sasav a itung.,,曬在外面的衣服都乾了。,
703963,24,namikakimi,2403994,正哭著臉,,namikakimi timadju a qemauqaung.,,他正歪著臉哭著。,
703964,24,naminatuk,2403995,滾沸過,,naminatuk anga a su linalja a zaljum?,,你燒的開水已經滾沸了嗎?,
703965,24,namiqaqedru,2403996,男性器官正勃起,,"nu maqacuvucvung anan itjen, namiqaqedru a nitjen nu kadjamadjaman.",,年輕時期早晨起床性器官是勃起的。,
703966,24,namiseleman,2403997,憂鬱,,namiseleman aku varung tua ku pinasalivan tua ku kai tjai madju ka tiaw.,,昨天我對他講錯話心理感到憂鬱。,
