編號,語別,詞語,義項,翻譯,語句編號,語句,音檔,語句翻譯,出處
701618,24,kamenguaq,2401532,痊癒,,"kamenguaq a ku saqetjuan, mepupicul aken.",,當我的病痊癒時，我變得有力氣。,
701619,24,kameseng,2401533,夠了,,kameseng mapulavangaken.,,夠了我已經醉了。,
701620,24,kamilami,2401534,琅（瑯）橋,,pasu sangas tua drusaidai a cavilj a sinamazan i kamilami nua seamiszuku saka icu niamadju a kamilami.,,阿美族人在二百多年前遷居琅橋這裏。,
701621,24,kamurav,2401535,柚子,,aicu a buntan a kamurav puqetim saka qaljemqem.,,文旦的柚子甜又有汁。,
701621,24,kamurav,2401535,柚子,,sekauljan amen ni kina a ljemulju ta kamurav i zaleman.,,媽媽叫我們撿地上的柚子。,
701623,24,kan-,2401536,具有｢吃、食物、吃飯、餐具｣之意,,,,,
701625,24,kanadun,2401537,金崙部落,,aicu a i kanadun a qinaljan cinevucevungan nua mare timaljimalji a caucau.,,金崙部落是由多元族群所會集之聚落。,
701626,24,kanavalj,2401538,右邊,,kanavalj a lima a ku sivecivecik.,,我用右手寫字。,
701626,24,kanavalj,2401539,右手,,namaculju a ku lima a kanavalj,,我的右手被燙傷。,
701627,24,kanen,2401540,吃的,,ljemaceng ti kina tua uri kesain tua kanen nua qacang.,,媽媽在切要煮給豬吃的菜。,
701627,24,kanen,2401541,吃,,kanen ni kama azua sinan djamai ni kina.,,爸爸吃了媽媽煮的菜。,
701627,24,kanen,2401541,吃,,"kelju kelju, tjuma’u a’emiladj, anema a su kanen?",,來，來，請進屋裡坐，你要吃什麼？,
701627,24,kanen,2401541,吃,,"paramur sa zalangzangan, nangua’ a tja kanen azua a suika!",,好熱哦，我們把西瓜吃了吧！,
701627,24,kanen,2401541,吃,,"uwi, nangua’ a vuci’en tucu sa djuasi tua’atia, ulja sangua’ a tja kanen!",,好，現在就把它切了，我們再抹些鹽讓它好吃一些！,
701627,24,kanen,2401542,被吃,,"aicu a kubav mavan a papadjengan tua lami, nu pinituakubav inika kanen nua kulavav, saka inika salapelj uta.",,穀倉是貯藏糧食之處，糧食貯藏在穀倉內不會遭老鼠吃掉，也不會受潮。,
701628,24,kangida,2401543,何時（已發生）,,kangida nu pinantjezan?,,你們何時回來的?,
701628,24,kangida,2401544,何時（來）,,na mangetjezsun kangida?,,你何時回來的。,
701628,24,kangida,2401544,何時（來）,,na mangtjez mun kangida?,,你們何時回來的?,
701628,24,kangida,2401544,何時（來）,,na mangtjezmun kangida.,,你們何時回來的?,
701629,24,kangkang,2401545,鐘,,kaljeling a kangkang i kiukai.,,教會的鐘響了。,
701630,24,kanguhu,2401546,護士,,patjemaljialjia a sengsengan na kanguhu.,,護士的工作到凌晨。,
701631,24,kanipi,2401547,扁盒子,,papu tjamakuan ni vuvu a kanipi.,,祖父把香菸放在扁盒子。,
701631,24,kanipi,2401548,男子名,,ti kanipi a ngadan nakuqali.,,我的朋友叫kanipi(男子名)。,
701631,24,kanipi,2401549,法器袋,,"inika makaya cemelcel a pa’eteleng/paqeteleng taicu a kanipi, aya ta sinan palisi.",,不能隨意觸摸這些法器袋，這是禁忌。,
701632,24,kansiasai,2401550,感恩節,,aicu a qinpuqepu a mareka ljasiak nua sinzia a uri sika kansiasai tjaljakurdalan aicu nimun.,,為了要感恩祭，信徒匯集的南瓜你們的最大。,
701633,24,kanu,2401551,請你吃,,"kelju, kanu a kilingulj tjanuamen.",,來，與我們一起吃飯。,
701633,24,kanu,2401552,吃（東西）,,,,,
701633,24,kanu,2401553,吃,,"pu’imang sun aravac, na’emavay aken tasawni. sau kanu, ku pinicukui!",,你運氣真好，今天我做了小米糕。去吃吧，我放在桌上！,
701635,24,kanupic,2401554,女巫師專用法袋,,nuri vaik ti vuvu i qaljesir a palisi kacuin a kanupic.,,若女巫師 qaljesir (女子名)要施法時必會攜帶專門用的法袋。,
701637,24,kanzumi,2401555,魚罐頭,,sanguaq a kanzumi.,,魚罐頭很好吃。,
701638,24,kapacacapilj,2401556,有關係的,,neka nu makaya qemulip tua tja kapacacapilj.,,沒有人可以否認我們的關係。,
701639,24,kapanan,2401557,石門部落,,aicu a i kapanan a qinaljan zinang nua na kemasi tjuqaciljai a caucus.,,石門部落的居民主要是從舊石門聚落移居之。,
701640,24,kapaula,2401558,災難,,aicu a tjemuqez itjen tua kasiv a paqateleng avan a kasizuanan nuatja kapaula nu remaljiz.,,颱風所造成的災難肇因於我們隨便砍伐山林。,
701641,24,kapaz,2401559,根,,nu mavuk a kapaz nua kasiv inika valjut a kasiv.,,樹根若腐壞，樹就保不住了。,
701641,24,kapaz,2401560,根莖,,a kapaz na ljavucuvucu cemel tua maca.,,腎蕨的根莖是治眼睛的藥草。,
701641,24,kapaz,2401561,樹根,,ridraridren sa sualapi nimadju azua namacemu a kapaz na kasiv.,,他把腐掉的樹根鋸掉了。,
701642,24,kappa,2401562,雨衣,,izua maretimaljimalji a kappa tucu.,,現在已經有各式各樣的雨衣。,
701643,24,kapua,2401563,陶瓷；甕,,pizuau tua kapua a pinaisuan anga a padai.,,把搗穀好的白米裝入瓷甕裏。,
701644,24,kapuapua,2401564,豬油之壺,,a qalev nua qacang pizuazuain tua kapuapua.,,豬油都裝置在小陶甕的。,
701644,24,kapuapua,2401564,豬油之壺,,kapuapua ayaitjen tua papu qalevan a reretan.,,我們稱那用來裝豬由的陶壺。,
701645,24,kaqiljasan,2401565,正月,,nu kaqiljasan litjuku a ravac a qiljas.,,正月時月亮特別的圓。,
701646,24,kaqulidan,2401566,真實的,,kaqulidan a vincikan.,,真實的記錄。,
701646,24,kaqulidan,2401566,真實的,,tja sizangalan a kaqulidan a kakudan.,,我們要堅持真實的習俗。,
701647,24,karadikad,2401567,弄亂,,karadikad aken tua nemanga a masa ku duduan.,,我因生氣把東西弄亂。,
701648,24,karai,2401568,男用小腰袋,,pini karai a kini ljamljam nimadj.,,他把挖來的生薑放在小腰袋裏。,
701648,24,karai,2401569,睪丸,,aicu a karai kinacavacavan nua uqaljai.,,睪丸是男人的器官。,
701648,24,karai,2401569,睪丸,,karai a sini pukeljang nua naqemati tua uqaljai.,,睪丸是上帝給男人的特殊記號。,
701648,24,karai,2401570,網袋（男人專用）,,papizuanan ni vuvu tua taljiv katua tjamaku a karai.,,祖父的網袋是放置小磨刀石及抽煙包。,
701649,24,karakuda,2401571,工作,,nakuya malupi nu karakuda itjen.,,工作不可懶惰。,
701650,24,karangkang,2401572,空罐聲,,tjasizazav tua qayaqayam a karangkang nu kalja vaquan.,,小米成熟期我們用空罐聲驅逐麻雀。,
701651,24,karangu,2401573,籃子（腰籃）,,pinitua karangu a kiniljacengni kina.,,媽媽採集的野菜放在籃子裡。,
701652,24,karari,2401574,碎布,,inika venric a paqateleng a rarusan itungan a caucau tua karari.,,創作衣服的人不隨便扔掉碎布。,
701653,24,kariari,2401575,蝴蝶,,liav a kariari a miperperper ita puhanan.,,花園有很多的蝴蝶在飛。,
701655,24,karim,2401576,尋找,,karim aken tua ku aljak.,,我在尋找孩子。,
701656,24,karuarua,2401577,小舌,,gacel aku karuarua.,,我的小舌很癢。,
701657,24,karutailj,2401578,單邊力量（單連杯）,,aicu a karutailj avan a sitekel nua mamazangiljan nu tjezua tua namasan pazangal a palisian.,,稱為單邊力量之木杯是頭目在重要祭典時所用之飲杯。,
701659,24,kasalim,2401579,在昨晚,,nakivuciq anga piqacay ti Drangalu kasalim.,,Drangalu昨晚已動完肝臟手術。,
701661,24,kasasavan,2401580,前院,,ti kina tjaljumaza i kasasavan a djemapes ta va’u/vaqu kata dremasi a venayvay tua itung.,,媽媽會在庭院篩小米與曬衣服。,
701661,24,kasasavan,2401581,庭院,,,,,
701661,24,kasasavan,2401582,院子,,"azua a i kasasavan tua nia kakituluan, izua aza a djaraljap,",,在我們教室的外面有一棵榕樹，,
701661,24,kasasavan,2401582,院子,,namalingulingulj amen a tacekeljan i kasasavan a kaikaiv sa talidulidu tua i kalevelevan.,,我們一家人在院子裡圍在一起，一邊吃晚餐，一邊欣賞天空。,
701662,24,kasauni,2401583,剛才,,pasaqetju aravac a celalaq kasauni.,,剛才的閃電很驚人。,
701662,24,kasauni,2401583,剛才,,tima aza kasitjumaq kasauni?,,剛才來家裡的人是誰？,
701662,24,kasauni,2401584,剛剛,,"inia ke kaculja, tjaukaikaiv aken kasauni.",,我還不餓，我剛剛才吃過晚餐。,
701664,24,kaselangda,2401585,聽到、聽聞,,kisanparangan timadju kaselangda tu na vaikitjen a semenai ta kalaoke.,,他聽到我們有去唱卡拉ok就感到不是滋味。,
701665,24,kasengsengen,2401586,製作,,draqa nua kasiv a tja kasengsengen tua pacinku.,,我們是用分岔的樹枝做彈弓。,
701666,24,kaseparia,2401587,考上,,"kaseparia tua kinasikingan ta kumuing, masuvalisakedan a varung nua matjaljaljak nimadju.",,他通過公職考試後，雙親的心得以解憂。,
701667,24,kasepeljen,2401588,被動手腳,,aicu a supacugan kinasepelj nua na patalaq tjanusun.,,你的事件是被有心人動了手腳。,
701668,24,kasevengan,2401589,舊士文部落,,"aicu a i seveng na paljavak tua qinaljan i kasevengan, i tjecangalj katua i tangdi.",,士文部落含跨 Kasevengan， tjecangalj 以及 tangdi等三個聚落。,
701669,24,kasiaqu,2401590,要有羞恥心,,kasiaqu sasu kiumalj mana paria.,,你/妳要有羞恥心而且改過自新才正經。,
701670,24,kasicuayan,2401591,過去、以前,,kasicuayan kemasi tua vutjulj a qalev a seman abula tua sisan djamai.,,過去我們是從肥肉製作炒菜用的油。,
701671,24,kasikasepatj,2401592,大前天,,kasikasepatj na pacun amen tjaimadju i pukisian.,,大前天我們在火車站看到他。,
701672,24,kasikasiven,2401593,叢林；森林,,kasikasiven aravac azua i kavulungan.,,大武山滿是原始森林。,
701672,24,kasikasiven,2401594,山林,,kasikasiven a savid aza i zuwa.,,那裡是一片森林。,
701674,24,kasikatjelu,2401595,前天,,"kasikatjelu sini kacian anan nimadju, ljakua tucu inianga ka madjumak.",,前天他還在用剪刀，但今天就找不到了。,
701675,24,kasimaza,2401596,從這裡,,na kasimaza ti kina i dremedreman a paljilji tjai kaka ta kadjaman.,,伯母drmedreman(女子名)早上有來這裏探望姊姊。,
701676,24,kasimazanga,2401597,來過,,kasizua anga aken tua uma’/umaq nimadju.,,我來過他的家。,
701677,24,kasinguaq,2401598,平坦,,i ksinguaq a nu quma.,,你們的田地很平坦。,
701678,24,kasintan,2401599,地板,,sarunguaq a icu a kasintan.,,這個地板很舒坦。,
701679,24,kasinu,2401600,從哪裡,,kasinu aicu a nu qararat?,,你們的鵝卵石是那裡來的?,
701679,24,kasinu,2401601,去哪兒,,,,,
701679,24,kasinu,2401602,曾去哪裡,,kasinu sun tatiaw?,,你昨天去哪裡？,
701680,24,kasipuljacengan,2401603,去過菜園,,na kivurasi aken kati vuvu a kasipuljacengan tatiav.,,我跟祖母昨天去菜園挖地瓜。,
701681,24,kasiv,2401604,樹木；柴；叢林,,kakudralan anga a kasiv aku sinitalem ka kakerian aken.,,我小時候種的樹都長大了。,
701681,24,kasiv,2401604,樹木；柴；叢林,,neka nu kasiv i tjumaq.,,家裡沒有木材。,
701681,24,kasiv,2401605,樹,,izua ta’apuluan/taqapuluan a kasiv imaza.,,在這裡有一顆樹。,
701681,24,kasiv,2401606,樹木,,"azua a vat i zaleman katazua a’atjuvitjuvi i’apulu tua kasiv,",,地上的米粒和樹下的蟲，,
701681,24,kasiv,2401606,樹木,,"rulangda aken aravac tjai vuvu a menilingan, nu na’emiladj amen izua i ljawljaung tua kasiv.",,我們坐在樹下時，常常聽爺爺講故事。,
701683,24,kasizuan,2401607,來自…,,tjainan a kasizuan nua alju.,,蜜是來自蜜蜂。,
701684,24,kasizuanan,2401608,肇因；起因,,aicu a tjemuqez itjen tua kasiv a paqateleng avan a kasizuanan nuatja kapaula nu remaljiz.,,颱風所造成的災難肇因於我們隨便砍伐山林。,
701685,24,kasudraman,2401609,對…絕望,,nakuya keminamalji a paqateleng kasudraman itjen nua tjasalasaladj.,,不能隨便罵人，我們的夥伴會疏離。,
701685,24,kasudraman,2401610,疏離；失望；灰心,,nakuya keminamalji a paqateleng kasudraman itjen nua tja salasaladj.,,不能隨便罵人，我們的夥伴會疏離。,
701686,24,kasuga,2401611,春日部落,,aicu a i kasuga kinateveljan na se kasevengan katua se pavavalau a caucau.,,春日部落是由舊士文 和 pavavalau 聚落的居民共聚之處。,
701687,24,kasui,2401612,褲子,,ladruadruq a kasui ni kama,,爸爸的褲子很長。,
701688,24,kasuleman,2401613,天暗；天黑,,kasuleman amen i vavua katiav.,,昨天我們還在工作時天就已經暗了。,
701689,24,kasuqelaman,2401614,被嫌棄、被討厭,,"nakuya rupaivatjan itjen aravac, kasuqelaman itjen na qaliqali.",,不要經常遲疑，會惹人討厭。,
701690,24,kasusezaman,2401615,沒退燒,,aicu a sezam ni Masegseg kemasi tiav a patje tucu inia kasusezaman.,,Masegseg的高燒從昨天到現在都沒退。,
701691,24,kasusu,2401616,親屬,,nia kasusu azua mamazangiljan i padain.,,我家和padain (部落名)部落的頭目是親屬關係。,
701692,24,kasuy,2401617,褲子；女性長褲,,niaken azua ’ucengecengel/qucengecengel a kasuy.,,那件黑色的褲子是我的。,
701692,24,kasuy,2401618,褲子,,niaken azua ’ucengecengel/qucengecengel a kasuy.,,那件黑色的褲子是我的。,
701692,24,kasuy,2401619,女性長褲,,ni kina azua pini cukuy a ’ucengecengel/qecengecengel a kasuy.,,那件在椅子上黑色的長褲是媽媽的。,
701693,24,katagilj,2401620,因；根因；原因,,kiraqa ta cekelj a kisudju tua zuma vavayan mavan a katagilj tua rivurivuan niamadju.,,他們爭吵的根因是先生有外遇。,
701694,24,kataladjan,2401621,底部,,sekaman aicu tua masan kataladjan.,,這用來墊底。,
701695,24,katalem,2401622,剛種的,,tjau katalem aicu a veljvelj.,,這些香蕉是剛種的。,
701696,24,kataqed,2401623,睡著,,nu maluljaitjen satje kataqed madjuluitjen a sezetjen .,,很疲憊的狀態睡覺很容易感受被巫靈附身。,
701697,24,katengelayan,2401624,被愛、被喜歡,,aicu a gamel a maqacuvucuvung katengelayan nua timaimanga.,,勤勞的年青人人人都喜歡。,
701698,24,katiav,2401625,昨天,,katiav/tatiav kasi gakku/kakituluan a ku kaka vavayan.,,妹妹昨天去學校。,
701699,24,katiaw,2401626,昨天,,tima su saladj katiaw?,,你昨天的同伴是誰？,
701700,24,katiyav,2401627,昨天,,"namatjani aken katiyav, mana sika minevalak na ku kula.",,我昨天有跌倒，所以我的腳腫起來了。,
701701,24,katjaisangas,2401628,在…之前,,katjaisangas nekanudjalan nua kisia kemasi akaw asema taitu.,,先前屏東到台東是沒有火車。,
701702,24,katjaladjan,2401629,地基；底座,,kezeng aravac aicu a katjaladjan nua umaq.,,這棟房子的地基非常堅固。,
701703,24,katje,2401630,有…,,katje qimangan a djapalj ni muakai.,,muakai(女子名)的大腿有胎記。,
701703,24,katje,2401631,含有、包含…,,,,,
701704,24,katjecaquanan,2401632,箴言,,aicu a pinaka katjecaquanan a kai vincikan tua marka sinitulutulu a nanguanguaq a kakudan katua patjara kisusu tua cemas.,,箴言是記述有關道德與宗教教訓的書。,
701705,24,katjepiculan,2401633,有力的,,katjepiculan a cemas.,,神是有能力的。,
701706,24,katjiatji,2401634,陰蒂,,,,,
701707,24,katjung,2401635,爬檳榔用腳套繩,,a katjung siraqiraqiz ta saviki.,,這是爬檳榔用的腳套繩。,
701708,24,katjuruvuan,2401636,眾多人,,katjuruvuan a kinacemekeljan ni madju.,,他的家族人口眾多。,
701708,24,katjuruvuan,2401636,眾多人,,katjuruvuan angata a nu qinaljan.,,你們的部落本來就很多人。,
701709,24,katjutjung,2401637,花瓣；花朵,,,,,
701710,24,katua,2401638,和；與,,aicu a ku kava katua kasui kuzulj a pipenuljatan.,,我這一件衣服和褲子合起來是一千元整。,
701710,24,katua,2401639,和,,"a nia cengelj tucu, izua a kuka,’ecilu,’arizang katua lukuc.",,我們今天的中餐有雞肉、蛋、四季豆和山蘇。,
701710,24,katua,2401639,和,,anema a tjadjaljaw a pakabasu katua pakakisia?,,搭火車比搭公車快嗎？,
701710,24,katua,2401639,和,,azua a kaki’iljan niamadju izua a i tua nasalapelj a kadjunangan katua marekadrumur.,,牠常常躲藏在潮濕的土地裡和石子堆中。,
701710,24,katua,2401639,和,,"izua a ci’av,’uzang katua gang.",,海裡有魚、蝦和螃蟹。,
701710,24,katua,2401639,和,,"ljawpan, uri veneli aken tua’inpic katua vavecikan.",,老闆，我要買鉛筆和筆記簿。,
701710,24,katua,2401639,和,,madjadjaladjalan amen a ljemita tu’adav a kitulu katua kivangavang.,,我們每天在一起學習和玩耍。,
701710,24,katua,2401639,和,,mamav a nia varung tu uri veneli tua zitting katua sunatj a milingan.,,我們都想買字典和故事書。,
701710,24,katua,2401639,和,,mavan a papulami katua papuvusam nua mamazangiljan tazua a nasemalimsim katua azua a namaljekuya a kini’inuman.,,就是頭目送糧給那些貧苦的（家庭）和送好種給收成不好的（家庭）。,
701710,24,katua,2401639,和,,navaik amen katua ku salasaladj a semapusunatjan tatiav.,,昨天我和同學一起到書店去。,
701710,24,katua,2401639,和,,"nguanguaq aravac a kinaqadaqadavan a vuaq, na vaik amen katua ku kaka a sema penanan a kivangavang a manzaljuk.",,今天天氣很好，我和妹妹去溪邊玩水。,
701710,24,katua,2401639,和,,"nu cemuking tua paysu nu paljeteku tua paysu itjen katua semusu’ itjen tua tigami, izua uta yubing.",,如果要存錢、要提款或寄信，那兒也有郵局。,
701710,24,katua,2401639,和,,"nu masalut a i’inaljan tazua a’adav, inika amin a cemulju katua’emavay sakamaya,",,部落舉行收穫祭的那一天，不僅僅只是殺豬和做米糕而已，,
701710,24,katua,2401639,和,,nu pasauma’ tjara namapelju’ sakamaya tua ci’av katua’auzang azua a varukur niamdju.,,回程時船上總是裝滿了魚和蝦。,
701710,24,katua,2401639,和,,pusaladj aken uta a semnaw tua kinanan a kisi katua pia.,,我還幫忙清洗碗盤。,
701710,24,katua,2401639,和,,"tiamen a sepayuanzuku nu izua na’emaljup saka namalap ta sacemel, tjarasemiljeva tua lja’edi’edi katua marekakaka.",,我們排灣族人若有人去打獵並有獵獲，一定會分享給鄰舍和親友。,
701710,24,katua,2401639,和,,"tjara ku puljaten a keman a kinisi a kinsa katua djamay,",,飯碗裡的飯菜一定吃完，,
701710,24,katua,2401639,和,,tjuruvu aravac a ku’ali katua ku drava.,,我有很多男生和女生朋友。,
701710,24,katua,2401640,［連］,,“kiljivakan a marka su’ali katua su drava.”,,對朋友要相愛，,
701710,24,katua,2401640,［連］,,"izua ti vuvu a u’aljay, ti kama, ti kina, tiaken katua ku kaka a vavayan.",,有祖父、爸爸、媽媽、我和妹妹。,
701710,24,katua,2401641,［斜］,,maumaljanga aravac katua sicuayan a nia’inaljan.,,我們的部落和從前（相較）已經有很大的改變。,
701712,24,kaukav,2401642,鐮刀,,radjai a ravac a kaukav ni kaka.,,我哥哥的鐮刀很利。,
701712,24,kaukav,2401642,鐮刀,,timadju malap ta kaukav sa kemeriz ta cemel tu sipakan ta ljuang.,,他拿鐮刀割草給牛吃,
701713,24,kaumaqan,2401643,原住處,,tjara izuazua a tja kaumaqan a qinaljan anga.,,每個聚落都有原住處。,
701714,24,kauqaljayan,2401644,男子漢,,ka hicuayan izua kakudan a vaik a kiqulu a kauqaljayan.,,在過去，獵首是成為真正男人的習俗。,
701715,24,kaus,2401645,湯勺,,izua nia kaus a sicuayan anga.,,我們家有很久以前就留下來的湯勺。,
701716,24,kausu,2401646,請你舀…來吃,,kausu azua taud sa kani.,,把湯裏的豆子撈來吃。,
701718,24,kautju,2401647,刨刀,,izua kautju ni kama.,,我父親有刨刀。,
701719,24,kava,2401648,上衣,,qiljaqiljang anga a kava ni kama,,爸爸衣服髒了。,
701719,24,kava,2401649,衣服,,matjevenganga a kava nimadju tua zengzengan.,,汗水弄濕透了他的衣服。,
701720,24,kavalanga,2401650,懷念,,kavalanga tangidangida,,懷念過去某個時光。,
701720,24,kavalanga,2401651,令人羨慕,,,,,
701720,24,kavalanga,2401652,很羨慕,,kavalanga sun a maca’u a’ivu a kemacalisiyanan.,,很羨慕你會講排灣語吶。,
701721,24,kavalanzuku,2401653,葛瑪蘭族,,"aicu a kavalanzuku i kalingku king, nasedjameq ta gadu katua ljavek.",,葛瑪蘭族是坐落在花蓮，是依山伴水的民族。,
701722,24,kavaljayan,2401654,依戀不捨的樣子,,,,,
701723,24,kavaluan,2401655,百合花,,aicu a kavaluan sini pakialap tua maseqetjan nua vavayan.,,百合花的清香用來比喻女人的純潔。,
701723,24,kavaluan,2401656,野百合,,liav a na cemuvu’/cemuvuq a kavaluan i kadjalanan.,,路邊長了很多野百合。,
701724,24,kavan,2401657,穿著上衣,,kavan a su itung.,,你穿著你的傳統服飾。,
701725,24,kavara,2401658,屋瓦,,vaiki a kiveli tua kavara.,,我們去購買磚瓦。,
701726,24,kavatjes,2401659,小竹籃,,qaruten a paka tua kavatjes ni kina a vasa tua mareka namapulju a caucau.,,母親用小竹籃把竽頭分享給窮困的人。,
701726,24,kavatjes,2401660,檳榔用籃,,a kavatjes papusavikian tua tjatjangtjangen.,,檳榔用籃是放置檳榔的盒子。,
701727,24,kavatjesan,2401661,小籃子的量,,kavatjesan a mareka nu salasaladj pi tua kavatjes.,,用小籃子分別以小籃子的量給你的同伴們。,
701728,24,kavecengel,2401662,農田之禮,,nu kalja qinuman itjen tjara izua kavecengel tua mamazangiljan.,,農作物收成時都會有所謂農田之禮。,
701730,24,kaviaqan,2401663,手掌,,na mangada a kaviaqan ta ljavia.,,我的手掌被蘆葦割傷。,
701730,24,kaviaqan,2401663,手掌,,qevadu ta su kaviaqan a puk.,,用你的手掌抓起樹豆。,
701731,24,kavic,2401664,背袋；背,,alapu a ku kavic.,,把我的背袋拿過來。,
701732,24,kavicu,2401665,請你背起來,,kavicu a sikau ni suvuvu.,,阿公的背袋請你背起來。,
701733,24,kavikavic,2401666,胸罩,,aicu a vavayavayan seman pazangal aravac tu kavikavic.,,女士很重視胸罩。,
701734,24,kaviri,2401667,左邊,,nama lingdjelj amen i pasa kaviri.,,我們站在左邊。,
701735,24,kaviriu,2401668,左轉、使…左邊,,nu tjalju zua mun tua maudraqa a djalan pasa kaviriu anga a kicepeliv.,,當你們到逹叉路時請往左邊轉回。,
701736,24,kaviyangan,2401669,佳平部落,,aicu a qinaljan i kaviyaqan sinialap tu maru itua tja kaviyaqan ana naseljenguaq.,,佳平部落的名字是取自於聚落的地景像是手掌心一般。,
701737,24,kaviz,2401670,下巴,,nguangua’/nguanguaq aravc a kaviz ni Muni.,,Muni的下巴很好看。,
701737,24,kaviz,2401670,下巴,,sinipatangez a ku kaviz ta cekui.,,我的下巴靠在桌子上。,
701738,24,kavuavuan,2401671,田園,,nu na kitjepis a malada tua vaqu i kavuavuan makayanga itjen a kivaqu.,,經女巫司摘下田園中初熟的小米穗之後，就可採小米。,
701739,24,kavudilj,2401672,獨有,,kavudilj nimadju a kinanguaq nua ljingav katua senai.,,美麗的聲音和歌唱是他獨有的。,
701740,24,kavulaqutan,2401673,因懶惰所以…,,kavulaqutan a quma nimadju manasika cemecemelanga.,,因為他懶惰，所以他的田園雜草叢生。,
701741,24,kavulj,2401674,具有討東西之意；請求；要求,,,,,
701742,24,kavulungan,2401675,山頂,,uri vaik amen a ljezaya tua tjaljavavavan a kavulungan.,,我們要去登最高峰。,
701742,24,kavulungan,2401676,大武山（地名）,,’aw azua a i kavulungan mavan a kinive’acan na payuanzuku a cawcau.,,而大武山就是排灣族人的發源地。,
701742,24,kavulungan,2401677,大武山,,i kavulungan a kiniveqacan nua payuan.,,排灣族的發源地是大武山。,
701742,24,kavulungan,2401677,大武山,,namasan pazangal a kavulungan i ta nia kakudanan.,,大武山在我們的文化中是非常重要的。,
701743,24,kavuqui,2401678,（古壺）小米粒外衣,,aicu a kavuqui a reretan namasan kakesan.,,古壺｢小米粒外衣｣是用來煮食。,
701744,24,kavusaman,2401679,酋長,,tjara izua namasan kavusaman tua tja qinaljan a pinu payuanan a caucau.,,我們排灣族的社會一定設有酋長。,
701744,24,kavusaman,2401680,當家的,,kavusaman timadju ta mamazangiljan.,,他是貴族裡當家的。,
701745,24,kavutan,2401681,免費,,kavutan aicu a mareka itung imaza piliqu tua nu kinatjenglayan.,,這些衣服全是免費，請自行選擇你們所喜歡的來穿。,
701746,24,kawkuy,2401682,苦瓜,,sanguaq angata nu kemesa itjen ta kawkuy kata kuka.,,苦瓜雞湯非常的好吃。,
701748,24,kay,2401683,語言,,maca’u/macaqu sun a lemangeda tua kay a kinacalisianan?,,你聽的懂原住民族的語言嗎？,
701750,24,kayaken,2401684,我不是才跟你說,,maya masepelj a siqunu ni su vuvu ayaken tjanusun inika sun a lemangda pay mavuciq anga su lima.,,我才跟你說不要動祖母的小刀你不聽，看吧！你的手割傷了。,
701752,24,kazaljuman,2401685,生水,,nu temekel itjen tua kazaljuman a paqateleng madele a izua valasa.,,隨便 喝生水容易有蛔蟲。,
701753,24,kazangiljan,2401686,佳義部落,,aicua i payuan tjaizua i kazangiljan.,,排灣村是佳義村的那一邊。,
701754,24,kazatjan,2401687,平的地段；平原；平坦,,kazatjan sa kinaizuanan nua setimur.,,三地門是坐落在平的地段。,
701754,24,kazatjan,2401687,平的地段；平原；平坦,,uri seman umaq amen i kazatjan.,,我們要在平原地建造房屋。,
701755,24,kazatjazatjan,2401688,平坦的；平原的,,kazatjazatjan aicu a nu qaqumain.,,你們耕作的田園很平坦的。,
701756,24,kazazaljan,2401689,萬安部落,,"aicu a se kazazaljan na kemasi tjanaumaq, tjuvangas, vavuavua katua i tjaljikerikeri.",,萬安部落是分別來自四個舊聚落tjanaumaq， tjuvangas， vavuavua 和 tjaljikerikeri。,
701757,24,kazelju,2401690,稅金,,tucu masan liyaliyavanga tja si pavaivai a kazelju tua sifu.,,我們繳納給政府的稅金是越來越多。,
701759,24,kazumazuman,2401691,其他時間,,tjasikimananga tua kazumazuman a qadaw satja kaljavaran a ljemenguaq.,,我們擇期再好好討論。,
701760,24,kazumazumananga,2401692,改天,,nu pinusaladjan itjen a semanumaq tjaratjen a venalet nu kazumazumananga qadaw.,,別人幫我們蓋房子另日就要回饋人家。,
