編號,語別,詞語,義項,翻譯,語句編號,語句,音檔,語句翻譯,出處
706027,24,semanljavaran,2406104,造謠,,nakuya semanljavaran a paqateleng tjasiselapai.,,不能隨便造謠我們會受害。,
706028,24,semanljemet,2406105,輕視鄙視,,aku sun a semanljemet aravac tjanuaken?,,你為什麼那麼輕視我呢？,
706029,24,semanljikayan,2406106,譏笑、批評,,nakuya semaneljikayan tua kai nua’ali’ali.,,不能譏笑別人所講的話。,
706029,24,semanljikayan,2406106,譏笑、批評,,nakuya semanljikayan tua kai nua’ali’ali.,,不可以批評別人講的話。,
706030,24,semanmaqacuvucuvung,2406107,成年禮,,izua tja kakudan a seman maqacuvucuvung.,,我們有成年禮儀式。,
706031,24,semannamacai,2406108,準備葬禮,,uri semannamacai nu tiaw ti kaqacan.,,明天要在kaqacan (家族名)家準備葬禮。,
706032,24,semanpakung,2406109,蓋廟宇,,navenarung a pairang tu semanpakung a pigadu.,,漢人打算在山上蓋廟宇。,
706033,24,semanpang,2406110,製作麵包,,macaqua semanpang ti kina.,,我母親很會製作麵包。,
706034,24,semanqavay,2406111,做小米糕,,semanqavay tjen nu masalusalut.,,豐年祭時我們要做小米糕。,
706035,24,semanquma,2406112,做田,,ari tja pusaladjai tjia vuvu a semanquma.,,我們去幫助爺爺/奶奶田裡的工作。,
706036,24,semanquzu,2406113,做飼料,,itua semanquzu a ku sengsengan.,,我的工作是在做飼料。,
706037,24,semansapui,2406114,火把,,nu tjeseleman itjen i vavua semansapui itjen tua zaman.,,如果天黑了才離開工寮就要用蘆葦梗做火把。,
706038,24,semansipaizan,2406115,製作扇子,,na semansipaizan ta ngat ti kama.,,爸爸用月桃製作扇子。,
706039,24,semansunatj,2406116,出書,,sa semansunatj a ku kama.,,我爸爸想要出書。,
706040,24,semantadalj,2406117,做梯子,,semantadalj ti kama tua qau.,,父親用竹子來做梯子。,
706041,24,semantjakaz,2406118,編竹篩子,,qau a nia kinasengseng a semantjakaz.,,我們用竹子做竹篩子。,
706042,24,semanumaq,2406119,蓋（石板）房屋,,uri semanumaq amen tua qinaciljai i makazayazaya.,,我們要在瑪家蓋石板屋。,
706043,24,semanvaleng,2406120,製作醃肉,,macaqu a semanvaleng ti vuvu a vavayan.,,奶奶很會製作醃肉。,
706044,24,semanvililj,2406121,輕視歧視,,maya ri a semanvililj tua zuma.,,不要輕視別人哦！,
706045,24,semanvusam,2406122,篩選種子,,nu makakivaquanga itjen semanvusam itjen tua tja sivusam nu mapavalitanga cavilj.,,我們收成小米之後我們要為明年篩選種子。,
706045,24,semanvusam,2406123,擁立頭目,,titjen a payuan tucu izuanga za semanvusam aya kakudakudan.,,我們現在的排灣族社會已經有所謂設立頭目儀式。,
706046,24,semapairang,2406124,去平地；到漢人的地方,,"nu semapairang sun,’aliusuanga a veneli tua kitti.",,你去平地時，順便買郵票。,
706046,24,semapairang,2406124,去平地；到漢人的地方,,uri semapairang sun nutiyaw ?,,你明天要去平地嗎?,
706047,24,semapaisu,2406125,用錢,,tjuruvu a semapaisu a singkiu.,,很多人用金錢買選票。,
706048,24,semapana,2406126,去河流,,puri semapana aken a ljemanguy.,,我想去河流游泳。,
706048,24,semapana,2406126,去河流,,tengelay aken a semapana ki gang.,,我很喜歡到河裡抓螃蟹。,
706049,24,semapesap,2406127,（用手）挖掘,,ku sinaliman a semapesap nu kiqaqilj aken.,,我採山藥時是用手挖的。,
706050,24,semapicul,2406128,憑著力量,,nakuya a semapicul nu mazepezep.,,不能夾著力氣與人談判。,
706051,24,semapulju,2406129,另人毛骨悚然,,semapulju aravac a kinipacayan nua caucau a kadjunangan.,,走到有人自殺過的地方會讓人毛骨悚然。,
706053,24,semasa,2406130,安撫；安慰,,nu izua kipaulaula i qinaljan tjara tja sazuain a semasa sa tja kainulian.,,部落有人遇難，我們得去探訪安慰並為他禱告。,
706054,24,sematjez,2406131,送（客人）,,pay vaikan a sematjez aicu a veljevelj a pasa ta tja lja’edi’edi/ljaqediqedi.,,請你把這個香蕉送給隔壁的人家。,
706054,24,sematjez,2406132,送,,ti kama i Kuy na sematjez tua kinasengeseng nimadju a kadrukadru.,,Kuy叔叔有送他所作的竹杯。,
706055,24,sematjumaq,2406133,進屋內,,izua nu sematjumaq a qatjuvi nu kalja zalangzangan.,,夏天有時候蛇會進到屋內。,
706056,24,sematua,2406134,走到什麼的,,sematua ceva ti vuvu a pudringay manu macingul timadju.,,祖父到險峻處放陷阱在進退兩難的窘境。,
706057,24,semau,2406135,趕走,,maya semau a ku vatu aya ti vuvu.,,祖輩說:不要趕走我的狗。,
706059,24,semaumaq,2406136,回家,,semaumaq mun nungida?,,你們何時回家?,
706060,24,semavac,2406137,堆材,,semavac tua kasiv a padjele tua uri sicapa tua vasa.,,為了要烘焙芋頭要堆積木柴。,
706061,24,semavaqar,2406138,令人噁心,,semavaqar a caucau a pulapulavanga sa utjautjaq saka namapuisiqanga kasui.,,看到醉酒的人，嘔吐又已經尿濕褲子就會令人噁心。,
706062,24,semavavua,2406139,到田園,,vaik ti kina kati kama a semavavua.,,媽媽和爸爸下田去。,
706062,24,semavavua,2406140,去田裡,,vaik a sema vavua ti kina.,,母親去田裡。,
706063,24,semavid,2406141,專挑,,semavid timadju a kipusengsengan tua pazangal.,,他專挑困難的事情做。,
706068,24,semekaulj,2406142,使喚,,"semekaulj aken ta ku kaka vavayan, a sematjez ta kakanen ni kama.",,我使喚妹妹去送東西給爸爸。,
706068,24,semekaulj,2406143,請他人幫忙,,aku sun a semekaulj sakamaya ta qaliqali?,,你/妳怎麼總是叫別人幫你/妳忙?,
706069,24,semekez,2406144,停止,,nu semekez atja qavuvung maca itjen a pakazuazua.,,我們心臟如果停止就會立即死亡。,
706069,24,semekez,2406145,休息（停止工作）,,,,,
706070,24,semelaw,2406146,川燙,,nuri cemavu semelaw a pakasangas ta ngat.,,做米粽之前，先要把月桃葉川燙過。,
706070,24,semelaw,2406146,川燙,,semelaw ti kina tua ljaceng a djaudjaw.,,母親煮野菜時都用川燙的。,
706071,24,semelem,2406147,埋葬,,semelem  aya uta tazua cemvelj tua namacai a caucau.,,"埋葬的另一種說法就是""semelem""。",
706072,24,semeliap,2406148,天空紅紅的,,nu uri venali semeliap ai kalevelevan.,,如果有颱風要來天空就會紅紅的。,
706074,24,semeljud,2406149,使用,,tuluan aken ni kama ta kemuda semeljud ta tjatjukun a kivurasi.,,爸爸在田裡教我如何使用鋤頭挖地瓜。,
706075,24,semeljudj,2406150,全部吃光,,kanen a semeljudj nua qatjuvitjuvi avunavun nua ljaceng.,,菜苗全部被蟲吃光。,
706077,24,semema,2406151,向…吐舌,,nakuya semema tua qaliqali masiaq.,,向別人吐舌的舉止是不禮貌的。,
706078,24,semenav,2406152,清洗,,tisun a uri semenav tua kisi nu sauni.,,等一下你來洗碗。,
706079,24,semenay,2406153,唱歌,,tjengelay sun a semenay?,,你喜歡唱歌嗎？,
706079,24,semenay,2406153,唱歌,,tjenglay sun a semenay?,,你喜歡唱歌嗎？,
706079,24,semenay,2406153,唱歌,,"uwi, tjenglay aken aravac a semenay.",,是的，我非常喜歡唱歌。,
706080,24,semengac,2406154,令人討厭,,semengac a kai nimadju namaya uta kinudan nimadju.,,他的言行舉止都令人討厭。,
706081,24,semepet,2406155,扭乾,,lemima itjen a semepet tua tja vinateqan ka sicuayan.,,過去我們都用手扭乾衣物。,
706083,24,semeqetj,2406156,存,,nanguaq a semeqetj tua paisu a pi ginku.,,存錢在銀行是好事。,
706084,24,semequ,2406157,聞；嗅,,semequ a ngiav tua ciqav.,,貓聞到了魚的味道。,
706084,24,semequ,2406157,聞；嗅,,semequ a vatu ta kakanen .,,狗會聞食物。,
706088,24,semetu,2406158,觸電,,semtu azua tilivi kipapaulingavu.,,那座電視會使人觸電要小心。,
706090,24,seme’u,2406159,聞（如聞味道）,,nu seme’u/semuqu itjen taicu a vuciar salum aravac.,,花聞起來很香。,
706091,24,semevalj,2406160,揹（人）,,semevalj ti kama ta ku kaka vavayan a tjuma’/tjumaq ayata na sekata’ed/sekataqed anga timadju.,,爸爸揹著妹妹回家因為她睡著了。,
706091,24,semevalj,2406161,背起,,kasicuayan semevalj aken tua ku kaka sema gakku.,,我過去都背起弟弟上學。,
706091,24,semevalj,2406161,背起,,semevalj ti vuvu tjanuaken a vaik a kivala.,,奶奶背著我到處串門子。,
706092,24,semevec,2406162,弄直,,semevec aken tua namarukung a vatjuljayan.,,我把灣的鐵條弄直。,
706093,24,semevus,2406163,熄火,,nakuya inika semevus tua sapui i gadu.,,在山上要熄滅火星。,
706095,24,semiaq,2406164,令人不齒,,pai kiumalju semiaq sasu sikudan.,,改過自新吧，你的所作所為令人不齒。,
706096,24,semiav,2406165,喝湯,,tjara ken a semiav nu keman aken.,,我吃飯一定要喝湯。,
706097,24,semicuacuayan,2406166,很傳統的,,,,,
706098,24,semika,2406167,鋪床,,pisalim tjara pusaladjan aken sakamaya ni kina a semika.,,每天晚上媽媽都會幫我鋪床。,
706099,24,semikau,2406168,背著線織袋（網袋）,,nasemikau ti vuvu a semavavua.,,祖母揹著後背袋去山上。,
706100,24,semila,2406169,使人感到膩,,semila nu qalum sakamaya a paluvluv.,,如果餡都是肥肉容易使人吃膩。,
706101,24,semiljeva,2406170,分享獵肉,,tjaljanguaqan azua tja kakudanan a payuan tua semiljeva tua tja djinameq a sacemel.,,分享獵物之肉是我們排灣族的習俗中最美好的。,
706103,24,seminamalji,2406171,令人不可思議,,,,,
706104,24,semingilj,2406172,燃燒小米梗產生之燻煙,,semingilj tua qinaljan a pulingaw nu pasusangas tua masalut.,,收穫祭之前巫師用燃燒小米梗產生之勳煙來潔淨部落。,
706106,24,semiqisiqitj,2406173,正斜眼看,,pacunu azua timadju a semiqisiqitj a kicakaw a pacun tua zuma.,,看那個人正斜眼偷看別人。,
706107,24,semiqitj,2406174,斜眼,,semiqitj a pacun ta zuma timadju.,,他是斜眼看別人。,
706108,24,semivasi,2406175,芒草覆蓋石板法,,aicua semivasiv ta ravuc paljakev tua qaciljai.,,用芒草覆蓋石板屋是為保護石板。,
706109,24,semiyup,2406176,吸,,aza lumamad nu semiyup/menutjemutj tua ’etim/qetim na kina nangua’/nanguaq aravac tua caljuvuqan.,,嬰孩吸食母奶有益健康。,
706110,24,semkep,2406177,孵蛋,,,,,
706111,24,semkez,2406178,停止,,nasa nekanga nu dinci ku na semkez sa tuki.,,時鐘停止可能沒有電池了。,
706111,24,semkez,2406178,停止,,semkez anga za ’udjalj i sasav.,,外面的雨停了。,
706112,24,semnai,2406179,唱歌,,neka nu makulung a semnai tua kacalisian ka sicuayan.,,過去沒有原住民不會唱歌。,
706113,24,semnasenai,2406180,正在唱歌,,semnasenai ti vuvu tua sincuayanan a senai.,,祖母正在唱古老的曲調。,
706114,24,semqas,2406181,砍,,,,,
706115,24,semu-,2406182,具有｢除去…｣之意,,,,,
706116,24,semu ricing,2406183,砍除雜枝,,tiaken kati kama salialim amen a semu ricing.,,爸爸和我在砍除樹的枝條。,
706117,24,semualap,2406184,除掉,,,,,
706118,24,semu’aljic,2406185,剝樹皮,,salialim a semu’aljic/semuqaljic ta kasiv ti vuvu i tapav.,,祖父在工寮那剝樹皮。,
706119,24,semuap,2406186,打掃,,i tjumaq amen kati kaka a semuaq.,,我跟姊姊在打掃家裡。,
706121,24,semuca’ev,2406187,掀開（如掀開蓋子）,,maya semucaqev aza kesakesain.,,不要一直把煮鍋蓋掀開來。,
706123,24,semucemelj,2406188,清除垃圾,,nanguaq a semucemelj itjen nu sauni.,,待會兒我們要清除垃圾。,
706124,24,semucevelj,2406189,清除掩埋物,,nanguaq asemucevelj itjen nu sauni.,,待會兒我們要清除掩埋物。,
706125,24,semucikel,2406190,取消,,nakuya semucikel tua sinan pa’aeces.,,不能片面取消彼此契約。,
706127,24,semudjilai,2406191,吐…汁,,tucu nakuya semudilai a paqateleng tua inapuan patavungen itjen.,,我們現在不能隨便吐檳榔汁會被罰。,
706128,24,semu’eljev,2406192,打開,,sau vaiku a semu’eljev/semuqeljev ta ’ezung/qezung,,去把窗戶打開。,
706129,24,semuiljuq,2406193,挖耳垢,,ti kina na semuiljuq tjanuaken.,,母親幫我挖耳垢。,
706130,24,semukaizuanan,2406194,占地方、占空間,,,,,
706131,24,semukava,2406195,脫衣服,,na semukiam kasauni ti quzu.,,quzu(女性名)剛才還了債。,
706131,24,semukava,2406195,脫衣服,,"paramur sa zalangzangan, nanguaq a semukava.",,這麼悶熱的天氣，脫衣服較舒適。,
706132,24,semukedri,2406196,吃一點,,semukedri sun a keman.,,你吃的量很少。,
706133,24,semukiam,2406197,還債,,nakuya inika semukiam tua tja qali.,,不能不還向朋友借的錢。,
706134,24,semukuz,2406198,禁止,,"aicu a i maza kakipucemelan, manasika semukuz ta benusebus.",,這裡是醫院，所以禁止抽菸。,
706136,24,semuliav,2406199,吃太多太多,,semuliav anga sun aravac a keman.,,你吃太多了。,
706138,24,semumuqic,2406200,擦掉眼屎,,semu muqic aken tua ku vuvu!,,我幫孫子擦掉眼屎！,
706139,24,semungadjai,2406201,清除鍋牛黏液,,uri semungadjai aken tua ku kiningaci.,,我要清除鍋牛的黏液。,
706140,24,semungicu,2406202,削（水果）,,semungicu ti kina ta vangalj sa pakani amen.,,媽媽削水果給大家吃。,
706141,24,semupaisu,2406203,浪費錢,,"maya cuay nu pakadingva, semupaisu.",,電話不要講太久，話費很貴。,
706142,24,semupalalj,2406204,去羽毛,,semupalalj itjen nu cemulju tua kuka.,,殺雞要去除羽毛。,
706143,24,semupu,2406205,讀書,,icengceng aken a semupu.,,我正在讀書。,
706143,24,semupu,2406205,讀書,,"uri kisamulja aken a semupu,",,我要努力讀書，,
706143,24,semupu,2406206,讀,,izua i tua sunatj. nu kisamulja itjen a semupu tua sunatj ljiavavav a tja kineljangan.,,在書裡。勤讀書可以讓我們增加知識。,
706144,24,semupulju,2406207,除喪,,,,,
706145,24,semupusupu,2406208,正在讀書,,semupusupu a ku vuvu i ’akaw.,,我的孫子在屏東讀書。,
706145,24,semupusupu,2406209,正在數算,,semupusupu ti kuljelje tua namaqepuqepu a caucau.,,kuljelje(男子名)正在數算來聚會的人。,
706146,24,semuqaca,2406210,喝多,,ka masudjusudjuamen na semuqaca tikama a temekel tua vava.,,爸爸在我們結婚時喝很多酒。,
706147,24,semuqadjai,2406211,解開繩子,,pusaladji aken a semuqadjai tua ku kinacu.,,請幫我解開行囊的繩子。,
706149,24,semuqayav,2406212,逾越,,nakuya semuqayav tua kakudakudan.,,不要逾越秩序。,
706150,24,semuqelam,2406213,令人討厭,,semuqelam aravac a su sikudan.,,你的行為令人討厭。,
706151,24,semuqeljev,2406214,開啟,,semuqeljev aken tua paljing nua suku.,,我開啟倉庫的門。,
706153,24,semurabu,2406215,舖設水泥,,semurabu amen nu sikatjelu.,,後天我們要舖設水泥。,
706154,24,semuram,2406216,令人失望的,,semuram aravac a sikudan nimadju.,,他的行為很讓人失望。,
706155,24,semusu,2406217,探索認定,,izua a tja kakudan a semusu tua aljak.,,我們有認定子嗣的習俗。,
706156,24,semusuq,2406218,寄送,,ari vaiki a sema yubinkiuku a semusuq tua ku tigami tjai sukaka.,,我們去郵局寄送給你哥哥的信。,
706156,24,semusuq,2406218,寄送,,na vaikaken a semusuq tua ku tigami.,,我剛去寄送我的信。,
706157,24,semutj,2406219,窒息,,sebuqbuq timadju mana sika semutj.,,他溺水窒息。,
706158,24,semutj-,2406220,具有｢停止呼吸｣之意,,,,,
706159,24,semutjaljupun,2406221,脫帽,,maya tjemalupun nuaya zua papapenetj semutjalupun itjen.,,當有規定禁止戴帽子時我們就要脫帽。,
706162,24,senai,2406222,詞,,nguanguaq a ravac sa patarevan nusa senai.,,這首歌的詞意很美。,
706163,24,senai-,2406223,具有｢歌曲｣之意,,,,,
706164,24,senav-,2406224,具有清洗之意,,,,,
706165,24,senavalj,2406225,南排灣族,,,,,
706166,24,senavanin,2406226,清洗,,senavanin nimadju aza kizing a namakelu a mazaleman.,,他把掉在地上的湯匙拿去洗。,
706166,24,senavanin,2406226,清洗,,senavin ni kaka azua kungai nua palidring.,,哥哥清洗了車子的汙垢。,
706167,24,senay,2406227,歌,,nguangua’/nguanguaq aravac a ljingav nua senay ni kina.,,媽媽的歌聲很好聽。,
706167,24,senay,2406228,歌曲,,"tjara’emacuvung amen a’ivu a kemacalisiyanan tu tapulu’ a kalan kata kinacalisiyanan a senay,",,我們必須完成說十句排灣語的感謝話，或唱一首排灣歌謠，,
706168,24,senema,2406229,哪裡人,,senema mun?,,你們是哪裡來的?,
706169,24,sengac-,2406230,具有｢討厭｣之意,,,,,
706170,24,sengacan,2406231,不在乎,,sengacan nimadju tjanuaken manasika napasulivai sakamaya.,,由於他不在乎我，所以他從來就沒有面談。,
706172,24,sengesengan,2406232,工作,,namagula cu a sengesengan.,,這個工作是被取消的。,
706173,24,sengkunglu,2406233,省公路（道）,,kinivalidian nua sengkunglu aicu a tja kuni i taiwan.,,省公路繯繞着我們的國家台灣。,
706174,24,sengseng-,2406234,具有｢工作、製作｣之意,,,,,
706175,24,sengsengan,2406235,工作；職業,,,,,
706175,24,sengsengan,2406236,工作,,iya!’aw anema a sengsengan ni tjaina?,,喔！你媽媽從事什麼工作？,
706175,24,sengsengan,2406237,職業,,anema su sengsengan tucu?,,你現在的職業是什麼?,
706176,24,sengsengan i tjuma’,2406238,家務事,,ma’utjav/maqutjav ti kina ta sengesengan i tjuma’/tjumaq.,,母親忙著家務事。,
706177,24,sepacengceng,2406239,適逢,,ka pucekecekeljmun sepacengceng tu i taihuku aken.,,你們結婚當天我正好在台北。,
706177,24,sepacengceng,2406239,適逢,,"sepacengceng tu qemavaqavai tia matalaq, puqimang sa mareka maqacuvucuvung a keman.",,適逢matalaq家正在煮年糕，這些年輕人很幸運有年糕可以吃。,
706178,24,sepacevelj,2406240,遭埋,,kamacunuq a gadu i palikulikuz tua qinaljan tjuruvu ana sepacevelj.,,當部落後山崩塌時許多人遭到活埋。,
706178,24,sepacevelj,2406240,遭埋,,matu na sepacevelj a ku tjatjukun.,,我的鋤頭好像被埋在裡頭。,
706179,24,sepadjiqes,2406241,澆濕了,,ka djemiqes aken tua puljacengan sepadjiqes kasauni sa mareka ku itung.,,我澆菜的同時澆濕了衣物。,
706180,24,sepadria,2406242,考上；選上,,kisasa azua matjaljaljak nimadju ka sepadria timadju tua kini kemilingav a kisan sasusuan.,,他考上公職之後父母感到欣慰。,
706181,24,sepairang,2406243,是漢人（閩南族群）,,sepairang a ku ljaqediqedi.,,我的鄰居是漢人。,
706182,24,sepakacidilj,2406244,落單,,na sepakacidilj ti djanaw i makazayazaya ka sekaumaljamen asema masilidj.,,我們搬到 masilid村時 djanaw 一個人落單 在 makazayazaya 的家。,
706183,24,sepaljama,2406245,延燒,,ka ljemama aken tua nia dangdang sepaljama azua nia tapaw.,,我燒新耕地的乾草時延燒到我們的工寮。,
706184,24,sepaljavak,2406246,分部在於…,,aiacu a sepadain a caucau na sepaljavak tua i akaw katua i taitu a qinaljan nua payuan katua rekai.,,padain 舊部落的人已分部於屏東和台東兩縣的排灣族及魯凱族的村落。,
706185,24,sepaqaluqalu,2406247,台東排灣族,,pinaka sepaqaluqalu a payuan zuku i pasa taitu.,,台東的排灣族人被稱為 sepaqaluqalu。,
706186,24,sepaqudjalj,2406248,被雨淋,,na sepaqudjalj a nia vinateqan.,,我們曬在外面的衣服被雨水淋浴。,
706187,24,sepasaliv,2406249,犯錯,,,,,
706188,24,sepatj,2406250,四,,"ita, drusa, tjelu, sepatj, lima, unem, pitju, alu, siva... a,’aku mekedri tu ita?",,一、二、三、四、五、六、七、八、九…啊，怎麼少了一隻呢？,
706188,24,sepatj,2406250,四,,izua a sepatj a sunatj nimadju.,,他有四本書。,
706188,24,sepatj,2406250,四,,lima sa tjelju’i tu siva kitapulu’ katu sepatj a vatan a pipenuljatan. inika pazangal dri!,,五加九，總共是十四元。不貴嘛！,
706188,24,sepatj,2406250,四,,sepatj a qapuluan sa kasiw.,,四棵樹。,
706188,24,sepatj,2406250,四,,sepatj akula nua vavui.,,山豬有四隻腳。,
706188,24,sepatj,2406251,四朵,,uzai a vuciar a sepatj i salingawngawlj.,,在那野地上有四朵花。,
706189,24,sepatj a pulu’,2406252,四十,,malje/man sepatj a pulu’/puluq a sasupuan a caucau i kiukay.,,教堂有四十個人。,
706191,24,sepatjaqepuan,2406253,肆堆,,nia pinatja sepatjaqepuan atja kinivurasi a vuaq.,,今天採收的地瓜我們分成肆堆。,
706192,24,sepatjavatan,2406254,四元,,sepatjavatan a tjadaljeng tua canga.,,一束蔥四元。,
706193,24,sepelaqut,2406255,滑倒,,na sepelaqut aken kasauni.,,我剛剛滑倒。,
706194,24,sepelj,2406256,逗弄、捉弄（指無聊的行為）,,anema su sepelj?,,你幹嘛那麼無聊去逗弄？,
706195,24,sepeljuq,2406257,充滿,,sepeljuq a ku levan i varung.,,我心充滿快樂。,
706196,24,sepet-,2406258,具有｢扭、抽｣之意,,,,,
706197,24,sepi,2406259,夢；運氣,,"a mavungelay a ini tiamadju, niamadju a sepi.",,她是否會懷孕是他們的運氣了。,
706197,24,sepi,2406259,夢；運氣,,na secevung aken ta ku vuvu ita ku sepi.,,我在夢裡有夢見我爺爺,
706197,24,sepi,2406260,夢,,na misepi aken tua ’atjuvi/qatjuvi kasalim.,,昨晚我夢到蛇。,
706198,24,sepu-,2406261,感染,,,,,
706199,24,sepulingetj,2406262,瀰漫,,sepulingetj anga cevulj tusa kalevelevan.,,煙霧瀰漫在天空。,
706200,24,sepurpur,2406263,忙碌的樣子,,sepurpur aravac ti kina tua sengsengan.,,媽媽忙得不可開交。,
706200,24,sepurpur,2406263,忙碌的樣子,,sepurpur tua sengsengan timadju.,,他因為事情而非常忙碌。,
706201,24,seqaljudj,2406264,被沖走,,na seqaljudj i pana ku tjalupun.,,我的帽子被溪流沖走。,
706201,24,seqaljudj,2406264,被沖走,,pacun aken tua umaq a seqaljudj tua zaljum.,,我看見房屋被水沖走。,
706202,24,seqazalj,2406265,極端厲害,,seqazalj a kinamapasaqetjuan ni kaka.,,我哥哥受傷嚴重。,
706204,24,seqeledj,2406266,不得再前行；止步,,manu seqeledj atja kinacu lagavi a maka tjuzuma.,,因為我們的行李此路不得再前行，另尋其他的路走。,
706205,24,seqelicing,2406267,過不去,,na seqelicing aken taza taljikerikeri a djalan itjaizua avan nukusicikecikel.,,我因為太胖過不了前面的窄小之徑，所以我折返回來。,
706206,24,seqeseq-,2406268,具有涼乾之意,,nunaremugerug tua tja kini vurasi tja seqeseqen a pivavaw tua pukasivan i kasasavan mana metad a kirimu.,,沖洗我們方才收成的地瓜之後，要放在戶外的木柴堆上比較容易涼乾。,
706207,24,seqetit,2406269,受委屈,,kumanu sun a seqetit aravac?,,你怎麼會這麼受委屈呢?,
706208,24,seqetj-,2406270,具有｢誠信、存｣之意,,,,,
706209,24,seqiladj,2406271,跌坐在地,,seqiladj aken a masa ku zelian.,,我因疲勞而跌坐在地上。,
706210,24,sequ,2406272,氣味；嗅覺,,pu sequ arevac aicu a vatu ni palanglang.,,palanglang的這一隻狗有很好的嗅覺。,
706211,24,seretjeg,2406273,沉沒,,,,,
706213,24,serupaq,2406274,踩到,,"na serupaq tua caqi nua vatu a ku kucu, mana sika sasequ.",,我的鞋子踩到狗糞所以有臭味。,
706214,24,sesazua,2406275,更加…,,sesazua selapai saku qesang ta ku kinipaqudjaljan ka tiaw.,,我因昨天淋雨，我的感冒更加嚴重。,
706216,24,setjaula,2406276,落榜,,na setjaula timadju tua kinasikingan tucu a cavilj ta kumuing.,,今年的公職考試他落榜了。,
706217,24,setjelangalj,2406277,向後仰；人仰馬翻,,matjani timadju sa setjelangalj.,,他滑一跤向後仰摔倒。,
706218,24,setjurudj,2406278,脆弱,,ti tjen a kacalisian setjurudj itjen a pimaza i ta patjara paisu.,,我們原住民在財金上是脆弱。,
706219,24,setu,2406279,麻,,,,,
706220,24,setukez,2406280,勤勞,,setukez aravac aicu a ma’acuvucuvung.,,這個年輕人很勤勞。,
706220,24,setukez,2406281,認真,,setukez amen aravac a masengseng.,,我們工作很認真勤勞。,
706221,24,se’u,2406282,味道,,salum aravac aza se’u/sequ na cinapan a vutjulj a na sevalivali a kemasi dut i tjanuamen.,,從你們家附近飄過來的烤肉味非常香。,
706223,24,sevacaq,2406283,出現,,papiupius aken i gadugadu manu sevacaq a qatjuvi.,,當我在山丘上吹口哨時蛇就出現。,
706224,24,sevalit,2406284,接替；更換,,timadju ana sevalit tua kusengsengan.,,他接替了我的工作。,
706225,24,sevalitan,2406285,祖先；祖靈,,,,,
706225,24,sevalitan,2406286,祖先,,aicu a ca’uan nua tja sevalitan a nama’edjen a kemasi tua pinacalivalivat i tua kinaikacawuanan a nemanga.,,這些我們祖先的智慧，是來自各樣生活的經驗所累積的。,
706225,24,sevalitan,2406286,祖先,,sinan kakudan nua tja sevalitan.,,祖先留下的習俗。,
706226,24,sevalj-,2406287,具有｢背負｣之意,,,,,
706227,24,sevec-,2406288,具有直；正；弄直之意,,,,,
706229,24,seveliuq,2406289,脫臼,,na seveliuq aku kula katiaw manasika na minvalak.,,我的腳昨天脫臼所以腫起來。,
706230,24,seveng,2406290,士文部落,,"aicu a i seveng na paljavak tua qinaljan i kasevengan, i tjecangalj katua i tandi.",,士文部落含跨 kasevengan， tjecangalj 以及 Tandi等三個聚落。,
706232,24,sevesevec,2406291,正直,,sevesevec a sikinemeneman ni madju.,,他的想法很正直。,
706233,24,seviri,2406292,北排灣,,,,,
706234,24,seviry,2406293,北排灣,,,,,
706235,24,sevuc-,2406294,具有｢掉落、稀疏｣之意,,,,,
706236,24,sevuljuq,2406295,摔出去,,ka kirukung azua turaku sevuljuq a kinacu a kasiv.,,當卡車轉灣時它載的木材摔出去。,
706237,24,sevur-,2406296,具有｢倒塌｣之意,,,,,
706238,24,sevuriad,2406297,散落,,sevuriad a tianes i cepeng.,,籮筐裡的橘子散落一地。,
706239,24,sevus-,2406298,具有｢熄滅｣之意,,,,,
706240,24,sevusen,2406299,把火熄掉,,ka makakesa ti kina tua niacengelj sevusen a sapui.,,母親煮好午餐就把火熄滅。,
706241,24,sezam-,2406300,具有｢發燒｣之意,,,,,
706242,24,sezaman,2406301,溫度；熱度,,namakuda a sezaman ni utji?,,女兒的發燒情形如何?,
706243,24,sezetj-,2406302,具有｢被附身｣之意,,,,,
